{
  "schema_version": "1.0.0",
  "feedback_id": "ft-parse-001",
  "generated_at": "2026-02-21T13:30:00Z",
  "failure_signal": {
    "class": "parse",
    "stage": "compile",
    "summary": "Goal string is missing a closing quote.",
    "continuation_allowed": true,
    "error_code": "PARSE_MISSING_QUOTE"
  },
  "confidence": {
    "score": 0.74,
    "rationale": "Token sequence around the goal declaration strongly indicates a single-character quoting error.",
    "calibration_band": "medium"
  },
  "alternatives": [
    {
      "id": "alt-fix-quote",
      "hypothesis": "Insert a closing quote at the end of the goal string.",
      "expected_outcome": "Parser accepts the goal declaration and compilation continues.",
      "estimated_success_probability": 0.82
    },
    {
      "id": "alt-rewrite-goal",
      "hypothesis": "Rewrite the full goal line to canonical syntax.",
      "expected_outcome": "Parse succeeds but may alter wording.",
      "estimated_success_probability": 0.6
    }
  ],
  "proposed_repair_action": {
    "action": "retry_with_patch",
    "rationale": "A narrow syntax patch is likely sufficient and low-risk.",
    "requires_human_approval": false,
    "target": "goal.literal",
    "patch_excerpt": "goal \"ship reliable parser\""
  },
  "provenance": {
    "run_id": "run-parse-001",
    "source_stage": "runtime",
    "trace_entry_id": "trace-parse-001",
    "contract_versions": {
      "semantic_ir": "0.1.0",
      "policy_profile": "0.1.0",
      "feedback_tensor": "1.0.0"
    }
  }
}
